what;when;with;where;why
Diplomado en Ciencia de Datos;2020;2020;Santiago, Chile;Facultad de matemáticas, Pontificia Universidad Católica, Chile
Análisis de Datos Longitudinales;2019 - 2020;Instituo de Sociología PUC;Santiago, Chile;Curso de 33 horas para analisis de encuestas longitudinales. Instituo de Sociología PUC
Manejo Eficiente de Datos con STATA;2019;;Santiago, Chile;Curso de 25 horas orientado a usuarios de nivel intermedio. Instituo de Sociología PUC
Escuela de Métodos Experimentales;2019;Centre for Experimental Social Sciences (CESS). ;Santiago, Chile;Curso de 2 semanas sobre experimentos en ciencias sociales. Centre for Experimental Social Sciences (CESS). 
Técnico en Administración de empresas;2009;DUOC UC;Santiago, Chile;Carrera Técnica de Nivel Superior. DUOC UC